{
"schema_version":1,
"experiment_id":"rust-typescript-retargeting-comparison-v1",
"timing_note":"this report has no timing comparison or cross-language rate claim",
"comparison_boundary":{"workloads_are_separate":true,"cross_language_generalisation":"not-supported","rust_semantic_retargeting":"not-implemented"},
"typescript_baseline":{"source_report":"semantic-retargeting-v1","dataset_version":1,"fixture_count":40,"semantic":{"false_confident_applications":0,"false_negatives":6,"false_applications":0},"textual":{"false_confident_applications":0,"false_negatives":1,"false_applications":0}},
"rust_workload":{"dataset_version":1,"fixtures":[{"fixture_id":"ambiguous-duplicate-rename","category":"ambiguous duplicate rename","expected_outcome":"safe-conflict","actual_outcome":"safe-conflict","exact_resulting_bytes_correct":false,"safe_conflict":true,"false_application":false,"false_negative":false,"parser_complete":true,"textual_fallback_required":false},
{"fixture_id":"macro-heavy-textual-fallback","category":"macro-heavy textual fallback","expected_outcome":"exact-textual-bytes","actual_outcome":"applied","exact_resulting_bytes_correct":true,"safe_conflict":false,"false_application":false,"false_negative":false,"parser_complete":true,"textual_fallback_required":true},
{"fixture_id":"parser-damaged-textual-fallback","category":"invalid-source textual fallback","expected_outcome":"exact-textual-bytes","actual_outcome":"applied","exact_resulting_bytes_correct":true,"safe_conflict":false,"false_application":false,"false_negative":false,"parser_complete":false,"textual_fallback_required":true},
{"fixture_id":"rename-after-cross-module-move","category":"function rename after cross-module move","expected_outcome":"exact-textual-bytes","actual_outcome":"applied","exact_resulting_bytes_correct":true,"safe_conflict":false,"false_application":false,"false_negative":false,"parser_complete":true,"textual_fallback_required":false},
{"fixture_id":"rename-after-insertion","category":"function rename after independent insertion","expected_outcome":"exact-textual-bytes","actual_outcome":"applied","exact_resulting_bytes_correct":true,"safe_conflict":false,"false_application":false,"false_negative":false,"parser_complete":true,"textual_fallback_required":false},
{"fixture_id":"rename-after-within-file-move","category":"function rename after within-file move","expected_outcome":"exact-textual-bytes","actual_outcome":"applied","exact_resulting_bytes_correct":true,"safe_conflict":false,"false_application":false,"false_negative":false,"parser_complete":true,"textual_fallback_required":false}],"aggregate":{"total_cases":6,"exact_textual_applications":5,"safe_conflicts":1,"false_confident_semantic_applications":0,"false_negatives":0,"false_applications":0,"semantic_attempts":0,"parser_complete_cases":5,"textual_fallback_required_cases":2}},
"limitations":["TypeScript v1 metrics are preserved by reference and are not recomputed here","Rust cases measure only exact textual patch outcomes plus syntax fallback evidence","No Rust semantic retargeting attempt or confidence result exists"]
}
